<?xml version="1.0" encoding="utf-8"?>
<!--シナリオデータのルート要素 -->
<!--@title：シナリオのタイトル -->
<!--@author：著者名 -->
<!--@xmlns:xsi、@xsi:noNamespaceSchemaLocation：システム情報
    テンプレートの設定をそのまま利用してください。
    編集時の補助設定なので、実行時にはなくても問題ありません-->
<scenario title="シナリオタイトル" author="著者名"
  xmlns:xsi="http://www.w3.org/2001/XMLSchema-instance"
  xsi:noNamespaceSchemaLocation="http://www.web-deli.com/sorcerian/next/stext/common/sgml.xsd">

  <!--シナリオの初期化情報 -->
  <init>

    <!--シナリオ起動時に生成される種族／性別／年齢を表す。
        すべてを許容する場合には指定しない -->
    <!--@race：種族（FIGHTER、WIZARD、DWARF、ELF）
        カンマ区切りで複数列記可 -->
    <!--@sex：性別（MALE、FEMALE）。複数列記は不可 -->
    <!--@age：年齢（YOUNG、ADULT、OLD）。カンマ区切りで複数列記可-->
	  <constraint race="FIGHTER,WIZARD" sex="FEMALE" age="YOUNG,ADULT"></constraint>

    <!--シナリオに適用するbgm（すべて既定ならば省略可） -->
    <!--@main：メインテーマ（既定はmain）-->
    <!--@happy：ハッピーエンド（既定はhappy）-->
    <!--@bad：バッドエンド（既定はbad）-->

    <!--命名のルール
        ・拡張子「.mp3」を除いたベース名で指定します（例えば、battle01.mp3ではなく、battle01）
        ・頭に「@」付きでシステム標準のBGMを意味します
        ・利用できる.mp3ファイルの名前については、STextページよりUtility 01を確認してください
        　（たとえば@field01、@castle01など）。
        ・標準BGMについては、シナリオフォルダーに.mp3ファイルを格納する必要はありません
        ・頭に「@」のないファイル名は、シナリオフォルダー配下の/bgmフォルダーを見に行きます。
        　対応する.mp3ファイルを準備してください。
        -->
		<bgm main="@field05" happy="@field04" bad="sigh"></bgm>
	</init>

  <!--アイテム情報-->
  <items>

    <!--個々のアイテム（複数列挙可） -->
    <!--@id：アイテムコード
    　　接頭辞は「i～」。シナリオ内で一意であること
        -->
    <!--@name：アイテムの名前 -->
    <!--#text：アイテムの説明（15文字程度）-->
    <item id="i01" name="こいし">何の変哲もない、石だ</item>
  </items>

  <!--フラグ情報 -->
  <flags>

    <!--個々のフラグ情報（複数列挙可）-->
    <!--@id：フラグコード
    　　接頭辞は「f～」。シナリオ内で一意であること-->
    <!--#text：フラグの表示名（15文字程度）。
        ステータス画面に粗筋替わりに表示されるので、できるだけ具体的な内容を。
    　　但し、先頭が「*」で始まるものは、ステータス画面で表示されない隠しフラグと見なす -->
    <flag id="f01">「☆」の道を調べた。</flag>
    <flag id="f02">*隠しフラグ</flag>
  </flags>

  <!--モンスター／罠情報-->
  <enemies>

    <!--敵／罠の情報 -->
    <!--@id：敵コード
        接頭辞「m～」。シナリオ内で一意であること -->
    <!--@name：敵／罠の名前（10文字程度）-->
    <!--@element：属性（敵のみ。地／火／水／風／霊）-->
    <!--@attack：攻撃の種類（物理／魔法／毒／石化／凍結／呪い／忘却から1つ）-->
    <!--@func：ダメージ式
        例：2L+R-STR。Lは左のサイコロ、Rは右のサイコロ
        @attackが状態異常の時は回避条件（例：DEX>5、WIZARDなど）
        カンマ区切りで複数指定も可（その場合はランダムに式を選択） -->
    <!--@drop：ドロップアイテム
        「mon/3」で「月×3」、「free1/50/50Gold」で「50Gold」
        無指定の場合は属性からドロップアイテムを確定 -->
    <!--#text：モンスターの説明（50文字程度）-->
    <enemy id="m01" name="人面岩" element="地" attack="物理"
      func="L-STR" drop="tue/3">喋るだけで、硬い岩だ。</enemy>
  </enemies>

  <!--実績情報-->
  <results>

    <!--個々の実績情報（複数列挙可）-->
    <!--@id　実績コード（接頭辞「r」。シナリオ内で一意であること） -->
    <!--@name　実績名（ex. ガジガジネズミ） -->
    <!--@level　難易度（1～5） -->
    <!--text　実績の成立条件（ex. 隧道でネズミに食い殺された） -->
    <result id="r01" name="冒険のはじまり" level="1">冒険を開始した</result>
</results>

<!--ライセンス情報-->
<licence>

  <!--作品情報（複数列挙可） -->
  <!--@name：曲名（bgmの場合）、利用場所（pictureの場合。街、酒場など） -->
  <!--@category：分類（bgm：音楽、picture：画像）-->
  <!--@creator：作者 or サイト名 -->
  <!--@url：参照先 -->
  <work name="ダンジョン" category="bgm" creator="Az"
    url="//venusaz.seesaa.net/"></work>
  <work name="グーラン" category="picture" creator="Falcom"
    url=""></work>
</licence>

<!--シナリオの各シーン-->
<scene id="0">
  プロローグ
</scene>
<!--
<scene id="100" items="-i01,i02" flags="f01,f02" enemies="m01,m02"
  end="happy" se="hoge" result="r01">
  本文
</scene>
<scene id="200" items="-i01,i02" flags="f01,f02" enemies="m01,m02"
  end="bad" se="hoge">
  本文
</scene>
-->
</scenario>