<?xml version="1.0" encoding="utf-8"?>
<scenario title="チュートリアル" author="Rio"
  xmlns:xsi="http://www.w3.org/2001/XMLSchema-instance"
  xsi:noNamespaceSchemaLocation="http://www.web-deli.com/sorcerian/next/stext/common/sgml.xsd">

<init>
  <bgm main="@field05" happy="@field04" bad="@town01" />
</init>

	<flags>
		<flag id="f01">「☆」の道を調べた。</flag>
		<flag id="f02">「〇」の道で、ジャイアントラットを倒した。</flag>
		<flag id="f03">「＊」の道で、怖い目を見た。</flag>
		<flag id="f04">*隠しフラグ</flag>
		<flag id="f05">*進行管理用の隠しフラグ</flag>
	</flags>

<scene id="0" flags="f02,f03,f04">
<![CDATA[
## ソーサリアン Textへようこそ！

ようこそ、ソーサリアン Textへ！
ようこそ、シナリオ開発の世界へ！

ここでは、まずシナリオ作成の基本のキ、
シーンについて理解します。

テスト](10 "f01&!(f02&f03&f04)"


[上手くいったら、次へ進みましょう](1)
[テスト](10 "f01&!(f02&f03&f04)")
[テスト2](11 "!f02&!f05")
]]>
</scene>

<scene id="1">
## シーンの移動

ゲームブックと言えば、シーン（パラグラフ）の移動。
シーンを移動しながら進んでいくのが、ゲームブック。

前のシーンでもボタンを押したら、シーンが切り替わりました。

プレイ画面の右上を見てみましょう。
確かに、「チュートリアル【1】」と書かれていますね。

### 移動ボタンを作成するには？

このような移動ボタンを作るには、以下のように表します。

```
[ボタンに表示するテキスト](移動先の番号)
```

たとえば、Scene 2に移動するボタンならば、こんな感じです。

```
[Scene 2に移動しよう！](2)
```

### やってみよう！ 

では、左のエディターエリアから自分で書いてみましょう。

編集するのは、下の部分です。
ボタンに表示するテキストは自由に変えて構いません！

---

！！ここを編集してみましょう！！

---

編集できたら、［シナリオを実行］ボタンをポチッとな。
そして、ボタンを押してシーン移動を確認してみましょう。
</scene>

<scene id="2">
## 物語のバックアップ

さて、Playgroundで編集した物語も、
そのままではページを切り替えた途端に消えてしまいます。

ここいらで一度、ファイルに保存しておきましょう。

左上に［ダウンロード］というボタンがあるので、こちらをぽちっと。

これでscenario.xmlという名前でPC上にファイルを保存できます。

### 実行可能な環境

あ、ダウンロード機能は最近のブラウザーだと、
大概大丈夫なはずですが、IE11はたぶん無理。
Chrome、Firefoxなどのブラウザーをご利用くださいね。

[いよいよチュートリアルも終盤です！](3)
</scene>

<scene id="3">
## 物語の分岐について

移動ボタンが作成できたら、
ソーサリアン Textでできることはぐんと広がります！

分岐するには、どうしたらいいかって？

カンタンです。
ボタンを複数用意すれば良いのです。

### やってみよう

ボタンはこんな感じで書くんでしたね。

```
[ボタンに表示するテキスト](移動先の番号)
```

ではでは、左のエディターエリアから
Scene 4、5へのリンクを作成してみましょう！

それぞれボタンテキストは
「ハッピーエンドへ」「バッドエンドへ」とします。

あ、例によって、編集するのは、下の部分ですよ？

---

！！ここを編集してみましょう！！
！！ここを編集してみましょう！！

---

え、むずかしい？

そんな人は、下の正解を写経してみましょうか。
写経も大切な練習です。

[ハッピーエンドへ](4)
[バッドエンドへ](5)
</scene>

<scene id="4" end="happy">
## ハッピーエンド

さてさて、最初のチュートリアルもこれでおしまい。

シナリオを終了するには、＜scene id="4" end="happy"＞
のように、「end="happy"」と付けてください。

これでボーナスアイテムが入手できたり、
すべてのデータが初期化されたりするので、
最後はend、
これお約束。

今回はハッピーエンドなので「end="happy"」ですが、
バッドエンドならば「end="bad"」です！

### 最後に

あ、下の［最初から冒険を開始する］ボタンを押してしまうと、
ページがリロードしてしまいます！

もし編集したデータを取っておきたいなら、
［ダウンロード］ボタンでファイルを保存しておきましょう♪

では、チュートリアル第2回でお会いしましょう～
</scene>

<scene id="5" end="bad">
## バッドエンド

さてさて、最初のチュートリアルもこれでおしまい。

シナリオを終了するには、＜scene id="5" end="bad"＞
のように、「end="bad"」と付けてください。

これでボーナスアイテムが入手できたり、
すべてのデータが初期化されたりするので、
最後はend、
これお約束。

今回はバッドエンドなので「end="bad"」ですが、
ハッピーエンドならば「end="happy"」です！

### 最後に

あ、下の［最初から冒険を開始する］ボタンを押してしまうと、
ページがリロードしてしまいます！

もし編集したデータを取っておきたいなら、
［ダウンロード］ボタンでファイルを保存しておきましょう♪

では、チュートリアル第2回でお会いしましょう～
</scene>

<scene id="10">
# Markdownについて

さあ、

シナリオデータを編集できたら、テキストの書き方についてちょっとだけ。

ソーサリアン Textのシナリオデータは、
Markdown（マークダウン）という記法で書かれています。

ブログなどでよく利用されている記法で、見出しや太字、箇条書きなど、
基本的な修飾を手軽に表現できます。

詳しくは、以下のようなぺージが役に立つんではなかろか。
https://qiita.com/tbpgr/items/989c6badefff69377da7






[other](10)
[happy](2)
[bad](3)
</scene>
</scenario>